{
  "schema_version": 1,
  "id": "web-search-providers",
  "name": "Web Search Providers",
  "version": "1.0.0",
  "description": "DuckDuckGo, Brave, Tavily, SearXNG and Jina search transports plus the web_search tool they inject.",
  "permissions": {
    "secrets": ["BRAVE_API_KEY", "TAVILY_API_KEY", "JINA_API_KEY"]
  },
  "capabilities": {
    "trusted_host": {"entry": "host.py"}
  }
}
